,date,name,comment,like,replies
727,2023-03-15T13:44:00Z,@user-zf7ig4uu1p,"Where do you even begin?  - Mass social stratification; caste system may not be spoken, but very much still exists - Extreme income inequality and urban poverty; you can find beggars everywhere and the wealthy are gods in the country - Mass corruption; government barely makes any attempt to root out corruption. Reputation as the scam call center of the world - Poor working culture; Indians do not possess anywhere close to the same sense of urgency and desire to work like its Chinese rivals. - Poisonous nationalism; the government constantly parrots its greatness, while ignoring the severe problems the country faces. Indians STILL blame the British for its problems over 70 years after it has gained independence.  There is no way India will become a great power any time soon. Its GDP is simply linked to its growing population. Weak infrastructure, healthcare, education, the list goes on. India needs to work on the basics before it aims to be a major power.",1,0
728,2023-03-15T08:34:50Z,@neiltf1173,Who can spot the error ,0,0
729,2023-03-15T08:32:06Z,@demon244,I think u don't know or may be u have forgotten that India was under British rule and the hole world knows that British have looted India but China was not under the British colonialism so that's the reason my friend,0,6
730,2023-03-15T07:25:33Z,@i_am_funny,Bihar is Ohio of India,1,0
731,2023-03-15T01:34:11Z,@tedtansley1523,There were a lot of weird errors in this video. One point Japan was spelt wrong in the infographic. Not sure how accurate the video is.,0,3
732,2023-03-15T01:07:30Z,@diludhillonz,"Brain drain is a major problem. Majority of well educated Indians are empowering the economies of USA, Canada, EU, Australia etc. India has to appeal to the younger generation to build their future here.  But too many issues like  corruption , pollution, climate change, safety issues especially for women, casteism, religious fanaticism etc forces the brightest to leave. Socially India is still very conservative.",0,0
733,2023-03-15T01:01:07Z,@ishawrizz,"FDI has increased( last year we reached the highest ever fdi inflow mark in a single year which was around 86 billion USD) but the economy too so the percentage doesn't really match up however i agree it should have been way higher.  Also the problem of workforce is also due to the fact the our constitution doesn't have any amendments regarding employment for teens, teens youngers than 14 can't work because it's illegal and older than 14 too cause' even the small businesses demand a well grown up adult that can understand stuff better(in their opinion) so basically most of the younger workforce usually 18-24 of age are just unemployed because either they are still studying in Universities getting their diplomas/degrees and the rest who are not satisfied with their degrees preparation for civil services exam (the acceptance rate is like 0.2%, they only select 150-180 and the participation pool is like 1million, here i am talking about exams like UPSC) so the rest that used their time preparing for it just remains unemployed. And the thing about women participation is true i agree with that, even if half of the women population started contributing to the economy by working, we will see a massive change in growth rate.",0,0
734,2023-03-15T00:20:09Z,@tomatoisasquishyfruit,"Our Oligarchs like to hide away the profits made by their workers in offshore safe havens or they just gamble it away in stock markets and so called \""investments\"". The rest of the money goes to run the massive government machinery and kickbacks and bribes. The fanstatstic thing is that the common men and women of India, who are over a billion in population have no idea abiut this. They are in perpetual misery for life and seek comfort inside that bubble.",0,0
735,2023-03-14T22:05:35Z,@Counterpart_,The AI Narrator is really annoying.,1,0
736,2023-03-14T20:46:00Z,@mikel1062,Centralized control has never worked in a long term application. And of course centralization means a lower happiness index for your populace,0,0
737,2023-03-14T19:44:35Z,@demonkingrimuru7844,To be honest there are top scoring geniuses who must be working out these problems: And i can't figure out why these guys on youtube who just study a few papers and think they can outperform a country's economists. There could be only one of the 2 possibilities that's stopping the growth  1. Interference of outside forces 2. Interference of inside forces (political parties),0,0
738,2023-03-14T17:51:41Z,@BomBoyzhiphop,India is like an Elephant  No one can stop this country from growing ,2,3
739,2023-03-14T17:49:50Z,@gugugaga1460,"Well, you can't expect women to go and work when, if they leave their house for even a moment they get groped or worse. Problem isn't women working, problem is... it's India.",1,0
740,2023-03-14T17:23:51Z,@MrAlly0019999,Unity between people to work towards a common goal and help each other has gone down drastically in the country. People are competing each other rather growing together.,24,2
741,2023-03-14T17:04:22Z,@anishbhanushali,"4:38 China: When its technocrats decide to dam a river, build a road or move a village, the dam goes up, the road goes down, and the village disappears.  India being a largest Democracy can't move that swiftly. There will always be some group opposing government action and thus policy makers has to think about safe rote rather than an efficient route.  The question is   \""Are these rappid growth worth the freedom, if that's the price you need to pay given the current circumstances \"" ?   That being said,   sometime slow and steady wins the race. We're already slow...All we need now is just to be steady enough ",2,0
742,2023-03-14T16:33:57Z,@AnkurSharmaASLI,"Thank you for deep study.  I agree : Government must increase their investment in EDUCATION, HEALTH and INFRASTRUCTURE   I don't agree :  1. Comparison with CHINA on implementation of the policy &  2. FOREIGN INVESTMENT must be increased but not blindly, they must be controlled and used to fuel 'Make In India' program",3,2
743,2023-03-14T15:01:01Z,@gituparnasarma,"Important pointers to be noted (P.S I am not defending India just putting some facts and not only making my mind on  some points you shared but there are also many things india could do to improve)  : (1)First of all India have grown as it should be in the decade I agree it had not in the past centuries because of socialist, marxist and communist policies. (2)Secondly India has already passed china in population (This video is old). (3)Thirdly While they say in ratio but It had to checked in population because Bangladesh,Pakistan and all the countries mentioned has lower population than India  so Male to female could be managed and also many of them were under strict risk charts under Female excate while China is a outright imperial Capatalist  country even more than US and also they had 2 decades of extra time while india did not. (4)I agree Unemployment is 5-7 % because population is growing and also Covid hit India badly as it's impact on country like India which is big and populous could have serious outcomes and we saw that to China. (5)Indian unemployment is really different it exists only in middle class that to also in lower and average and also with a portion of poor class. (6)While 0.8% extreme poverty left in country according to IMF and poverty is now 10%. (7) And also while Bangladesh Srilanka Pakistan and even some European economies like spain and even Ireland and also to many people's suprise Slavic and Nothern European Countries have Taken IMF bail out packages. (8)Yes modi could not double but He made sure That India faced less impact of covid and India's economy grows even out with recession in th world.  (9)Yes Exports could be grown up but Indian domestic market has already grown to a large for Indian domestic sellers. (10) Yes india has allocated very less to education and budget for research like isro is very low which I myself criticize but second thought government has increased vocational training in skill India and also in CBSE/ICSE/NIOS/even state boards and universities too. (11) But recently investment summit  in state of UP  and foreign sharks meet in Maharastra India got more than  net 500 billions dollars of investment as FDI. (12) India is growing but 7-8% is less I belive it should be atleast 12-16% as  in first 3 quaters of 3 years atleast  You can't deny this facts mow. (13) You forgot many of india's state as such as 13 are high HDI and 14 in medium and soon gonna join high hdi and also India is cheaper than Europe and Africa if per capita is concerned and as for PPP terms it is 3rd so More people can afford better lifestyle with low as 5000$ a years.",1,0
744,2023-03-14T11:29:02Z,@drexxdrazzer29,Not to mention the Highly corrupt officials!,1,0
745,2023-03-14T11:24:11Z,@omduttdixit3433,"I frankly speaking.  From The day india didn't condemn russia on ukraine war . I am starting to see more videos like problem in indian economy and recently the adani Hildenbourg.   But, these people won't cover about the ponzi scheme name \""fiat currency \"" running by us and upcoming de dollarization",2,7
746,2023-03-14T10:34:57Z,@ethereal9454,The mains problems with India is Limited quality education and corruption on massive scales which are swept under the rugs.,1,0
747,2023-03-14T10:20:57Z,@raosensei63,"what are you going to do in a factory where the workers aren't scared of you.  you can be kicked out.  workers can't.  and these trade unions are very powerful.  the political parties need them to survive.  without labor intensive manufacturing factories, the future of India looks bleak.  cheap brains are responsible for whatever good stuff that is happening over here.  right now non-manufacturing industries are driving India's growth.",0,0
748,2023-03-14T10:12:19Z,@raviniranjan5707,So many mistakes in charts and graphs,3,1
749,2023-03-14T09:47:02Z,@kanwarsinghgill1298,Healthcare? Education? Infrastructure? Nope. Statues? Monuments? Bullet train? Other useless flashy things?  Yep.,5,2
750,2023-03-14T09:35:11Z,@locco_him491,"Don,t make vidio if you not research properly..",1,0
751,2023-03-14T09:18:05Z,@maari7132,This video is to attract huge Indian population for views . Now every indian will try to prove it's intelligence in comment section.  Well India's neutral stand on Russia Ukraine war has have change the perspective of West towards India. So the narrative will come more in coming days,5,1
752,2023-03-14T09:13:26Z,@maari7132,Say thanks to khangress  for country's complex bueorocracy and socialist ideology for corruption,2,0
753,2023-03-14T08:30:19Z,@anjaliraychoudhury7253,"EYAR  TU  REP  HOL  ,NAJANE  MURKHOY  STEDIYAM  KHONOR  NAM  LOLE  (  RENDI  PLACE  JUWA )  MURKHO  DESH  SOLAY",0,0
754,2023-03-14T07:26:20Z,@aburetik4866,"After years of \""growth\"", lndia's per capita GDP now falls behind Bangladesh. The only growth in lndia is population and inflation.",5,0
755,2023-03-14T04:54:58Z,@Rod.Machado,"First, the lose billion on their traffic situation. Second, their industries that can push themthrough is highly centralized, Third, ther grasptotheir tradotions hold them back.",0,0
756,2023-03-14T04:26:56Z,@DilpreetSingh-sw3ei,This trend for India will continue till its engineers are undervalued and highly educated people continue to be pressed by undeserving people at the top.  Thats the main reason of Rain Drain too. EDIT: And Thanks for shedding some reality on this true democracy.,5,0
757,2023-03-14T04:14:41Z,@gowthamgirish4920,Wel,0,0
758,2023-03-14T03:02:44Z,@rahulsinghpanwar9250,1. Less Export 2. Gap between Rich and Poor 3. Low participation of women 4. Higher difference between Regions 5. Corruption,0,2
759,2023-03-14T01:35:57Z,@davidmathews5245,As an Indian I never bought it when people spoke too positively about India. As an insider it just didnt sound believable. This analysis is a lot more in line with the reality of things.,8,0
760,2023-03-14T01:10:24Z,@gopalakrishnanrg7129,First print in the name real Father of nation.,0,0
761,2023-03-14T00:24:43Z,@logicalmusaafir2103,India is a country full of religious haters zombies they don't care about health-care and Education hence their economic growth will never be on the same level as China.,2,0
762,2023-03-13T18:38:24Z,@rajeevalochana6013,Totally false investigation and a negative propaganda about India......,2,1
763,2023-03-13T17:16:12Z,@brajat5538,The bigger problem is people leading this country are ignorant ....,1,0
764,2023-03-13T17:06:14Z,@littlefeetvampire,"India needs to have an open mind like china, to make the worlds needs. India is crippled by its early religion and tradition, they should be able to make every product western fashion which is highly demanded, even the explicit  items just for example",0,0
765,2023-03-13T16:57:36Z,@uditin,"You actually cant compare a democracy with an autocratic government. Their is a fundamental difference between the two, while autocratic changes are sweeping and fast but short lived. Democratic changes are slow and long lasting as it has an important element called consensus building.",1,1
766,2023-03-13T16:40:00Z,@adityajoshi3105,So many sad truths to face.   1. Caste wise reservation.  2. Traditional Methods even in agricultural fields.  3. Huge chunk of economy is spent on pension plans.  4. Useless public monuments expenditure.,2,0
767,2023-03-13T16:18:55Z,@sunsh9n0,"It's simple, negative content about INDIA blows up quicker.",4,0
768,2023-03-13T15:28:05Z,@faizanhashmi389,prashant dhawan and his bhakt need to watch this,0,1
769,2023-03-13T15:20:00Z,@LeGeNdThUnDeR,"unpopular opinion- this video has so many errors but some good points too but far different from real problems for 1 example- women workforce - Indian women don't want to work in these kinds of industries but they want to work in IT, Medical, or the service sector. that's why  India's textile industry  is dominated by males 2nd he said the reason behind that is the poor education system but these kinds of industries do not need higher education. if you see other sectors which actually requires a high level of education Indian women is performing well in those sector and Indian doctors and IT professionals are world-class.",1,0
770,2023-03-13T14:46:33Z,@QUINSYlarynx,0:30 the map of india is inaccurate. Parts of Jammu and Kashmir state are disputed territories and don't belong to India.,1,1
771,2023-03-13T14:04:55Z,@VbpsOblivion,There is a lot of brain drain and low innovation.,0,0
772,2023-03-13T13:52:47Z,@saint84us54,"India is a deception their media & Bollywood shows only the bling life but in reality  toilet is a luxury there ,they worship cow & drink cow urine as sacred holy water ",1,0
773,2023-03-13T12:55:07Z,@ronny5788,Low iq Anglo saxons who don't even understand their own economy makes dumber videos on other's economy I'm not surprised.,2,2
774,2023-03-13T12:40:46Z,@Mrworldx,"Bankruptcy of a US Bank ...Now you should make a video on \""problem with US economy\""",2,4
775,2023-03-13T12:39:34Z,@rageshlnk8238,This congi channel. Pushing half-truths. Who opposed 'NEP' and 'CUET',1,0
776,2023-03-13T12:29:22Z,@rageshlnk8238,State wise cost included ?? Why you take percentage ,1,0
777,2023-03-13T12:21:27Z,@thahirahmed868,Capitalism wont save India.,1,1
778,2023-03-13T12:02:47Z,@benashley2955,4:52 nearly spat my cornflakes... what??,1,2
779,2023-03-13T11:16:39Z,@raghav90,I like the video in the beginning. Map of India was correct.  10:14 you showed the incorrect . Store watching the video. Exit. Will not like subscribe.,0,2
780,2023-03-13T10:54:18Z,@Mk-wt7ip,"Also say about the looters murderers european colonist who pushed india back 100 years.Robbed india of 45 trillion dollars , caused famines killed massacred millions of indians. The poor education system is given by european colonist. So instead of blaming indian blame yourself u idiot europeans",0,0
781,2023-03-13T10:54:07Z,@Mk-wt7ip,"Also say about the looters murderers european colonist who pushed india back 100 years.Robbed india of 45 trillion dollars , caused famines killed massacred millions of indians. The poor education system is given by european colonist. So instead of blaming indian blame yourself u idiot europeans",0,1
782,2023-03-13T09:51:31Z,@aatifnazar8203,this is what ram rajya is all about,1,0
783,2023-03-13T09:46:06Z,@manakshbhanushali,Thanks for using our correct map.,0,0
784,2023-03-13T09:45:32Z,@pradeepbayalkoti007,India waste more than to buy weapon than teach it's citizens,3,2
785,2023-03-13T09:30:25Z,@kashankhan6950,Thank you BJP,1,1
786,2023-03-13T09:20:25Z,@carcrush0922,This guy has no idea what he is talking about .,0,4
787,2023-03-13T07:25:13Z,@lifetech4146,India's positives  1. Work force. 2. Demand.  3. International stability.  India's weak point  1. Corruption. 2. Media.  3. Security.,2,0
788,2023-03-13T07:06:11Z,@ton-6182,"India doesn't care about medication and all, they are much more busy in wasting money to provide free electricity to farmers in order please them and get more votes.",2,0
789,2023-03-13T06:48:08Z,@satyaveersingh5128,"for USA and european countries ...we were, are and we will be a backward country ..does anyone in India care about your institution ..no one ..did you able to stop us ?? we are and we will make our country great ...we are not illiterates like Pakistani",1,13
790,2023-03-13T06:10:04Z,@vlentt,t yt,0,0
791,2023-03-13T05:53:59Z,@thunderb00m,The spending on education is deliberately low. This is so that politicians can keep their vote banks and make an uneducated voter base dance to their tune while plundering the treasury.,2,0
792,2023-03-13T05:36:49Z,@easyeducation2590,Nepotism rules,4,0
793,2023-03-13T04:33:59Z,@fr0xk,"While reducing the pay gap and improving education and employment opportunities are important issues that need to be addressed, it's not realistic to expect the government to fix everything overnight. It takes time and resources to make meaningful changes in these areas, and the government has to balance competing priorities and interests.  Moreover, the issue of pay gap and employment is not just about the government's policies but also involves market forces, societal attitudes, and individual choices. Some jobs and industries are simply more profitable and in demand than others, and it's not always possible or desirable to equalize pay and opportunities across the board.  Similarly, education and employment success depend on many factors beyond the teachers' dedication and the government's funding, such as students' background, motivation, and access to resources. It's not fair to blame teachers or the government for all the problems in education and employment, nor to assume that throwing more money or regulations at them would automatically solve them.",1,4
794,2023-03-13T02:41:23Z,@jdr429,One secret for India.... Never spend a dollar/rupee on welfare. Welfare is the most addictive drug on the planet.,0,2
795,2023-03-13T02:06:06Z,@georgesoros4223,"5:29 That is not Taiwan's flag, that is Samoa",0,0
796,2023-03-13T00:43:36Z,@binaryxd4812,"Gov. Won't be able to provide enough jobs no matter how much FDI then bring in, where currently India has highest FDI in world. Or even by carrying out mega projects. Only real economic boom would come with rise of Indian startups, which is good .. government has made lot of efforts in providing infrastructure for startups especially in tech based startups.",1,0
797,2023-03-13T00:38:55Z,@binaryxd4812,Per capita income is less because cost of living is also 15-20x less than any western country.,1,1
798,2023-03-13T00:17:35Z,@Abit_,why does taiwan have the samoan flag at 5:36,0,0
799,2023-03-12T20:39:12Z,@muhammadmahdin1934,"Why not make a video on Bangladesh next, the country you briefly touched up on while comparing the female labour forces. It's also got a higher literacy rate and GDP per capita than India.",0,0
800,2023-03-12T19:07:35Z,@sam.....1," Well by far this is the best video on India. But we should not forget that in reality, we got independence in 2014 after Narendra Modi came to power. ",1,0
801,2023-03-12T18:58:45Z,@jjp617,Dont make India a super power like US. India be just itself. Its current chaotic system makes it impossible to crush even under any consequences. Covid is an example.,0,0
802,2023-03-12T18:38:29Z,@user-vg1bk9ux6r,"Maybe if the Blind Bhakt Chokidar government put its money where it mattered instead of funding crooked & corrupt politicians and shady billionaires, this country would actually be taken seriously on a world level!",2,2
803,2023-03-12T18:30:24Z,@muhammadah6850,And we have Indians saying they are the best in the world LOL,0,0
804,2023-03-12T17:38:42Z,@misssparkle6421,"I think one more issue that hinders development of india is lack of carrier options. Sure we have science commerce arts, but there's barely any people who take arts these days as compared to number of people majoring in stem. Everyone is fighting for white collar jobs, and most don't even like what they're doing but they have to anyway to feed their families because that's most stable choice.   Just imagine if we had more advanced sports available as a possible carrier choice. Also kids nowadays are put under so much academic pressure to be ahead of their peers and be skilled beyond their age. There's not much left to enjoy the childhood. These kids need these physical activities. The only sports we got is cricket and kabaddi but that too only on national level at most. If india has international level of various sports there would be slightly less competition and more jobs.   Now I don't know much about sports since I've myself been more focused on academics all my life but recently I had this thought and it's bugging me ever since.",12,1
805,2023-03-12T17:22:06Z,@peterbriedon8058,"yo do not disrespect my country and place its flag as Russia pls, its Slovakia at 3:56",0,0
806,2023-03-12T15:08:22Z,@pepsicherry6389,"India takes donation money fom foreign countriey, buys russian oil cheap and sells it to the country which donated money for charity.",0,13
807,2023-03-12T14:44:58Z,@ban-estupid-people,"Sadly, all of it is true. Most of the state or national level universities prioritize exams over education.",0,0
808,2023-03-12T14:32:09Z,@yoda5084,It is easier to show one side of the story by presenting selected facts What about the number of expressways being built? what about 100% rural electrification?  what about lifting 300 million plus people out of poverty? what about world's largest healthcare program being run? what about targeted delievery of subsidy and services with neglegible leakages? what about GST ? (although it took time but increased the transparency collections) what about  banking system reforms and NPAs which came down? what about the controlled inflation? (when all your advanced economies are crushed by it)   I can count a lot of things but this video is just for building a narrative   There are problems and as a developing country with highest population in the world we are doing quite well,4,4
809,2023-03-12T14:29:59Z,@sudhamishra6753,"South Indian states were already enriched & developed under british rule but northern states of India didn't get so much attention by britishers due to the fact that coastal states (south indian states) have so much geographical advantages, it's widely accepted fact by economists that land locked states such as up,bihar, madhya pradesh, rajasthan, jharkhand don't have geographical advantages, southern states of India gotten industries as legacy by britishers bit there wasn't case with land locked states henceforth they had to induce development from root due to the fact that they got nothin' unlike southern states , another fact is that historically northern region of india was always under constant invasion and most of destruction, massacres, loot of wealth took place in northern states , britishers established ports at south indian states due to the fact that south indian states are surrounded by ocean wherefore ports can be only established at coastal region the prime example is gujrat infact entire economy of gujrat flourished due to ports but land locked states can't get ports cuz they ain't surrounded by ocean, britishers used to import & export through ports which were established at south indian states that's why developed took place over there, even till now any nation's import & export is being done through ports",4,3
810,2023-03-12T14:12:08Z,@bensonlilooto6317,"Hey, just letting you know you've used the Samoan flag at 5:35 for Taiwan's flag. They're really similar.",0,0
811,2023-03-12T12:49:39Z,@drkotapat8592,Honestly there is no problem with economy but the western media project that way anyway .. wait for 10 years the same YouTuber will say otherwise  ,3,1
812,2023-03-12T12:09:17Z,@penskepc2374,A lot of veiled Chinese propaganda wrapped in pseudo intellectual package on YouTube these days.,0,0
813,2023-03-12T11:53:46Z,@serialliar2361,"Am I losing it, or is the voice in this video AI generated?",0,0
814,2023-03-12T11:33:24Z,@jeeveshghatode9070,there is one party in india who is focussing on knowledge plus having only state with which they are in profit that's Delhi run by ARVIND KEJRIWAL as AAP government.. I think there policies are far far much better than central government  plz look into the matter and see the works done by them u will see the difference... also they have most educated party in india....,1,0
815,2023-03-12T11:09:57Z,@lazor6526,Be ready for hate by some blind followers,3,0
816,2023-03-12T10:33:13Z,@rkthebeast6910,Fact is the Indian Education system is literally trash...,2,0
