,date,name,comment,like,replies
1000,2023-03-08T01:03:11Z,@s0ulweaver,"You are correct but also incomplete. India is so vast (not just in landmass) in it's cultures, languages, heritages, castes that it is not just to analyze it in as much time as other countries. Just like you can take more time to analyze Japan than China, simply because the complexity is more, the same way you'll need to give India more time for it's inter-state & intra-state interaction and inter-religious & intra-religious interactions. They are so significant that they govern politics and economics of India. India may be the most complex nations of all in that aspect.",2,0
1001,2023-03-08T00:18:45Z,@JaxFacts,,0,0
1002,2023-03-07T23:28:31Z,@omegasensei382,"People use democracy as excuse- That is a lame excuse world. Most richest countries as per capita income are democratic countries, not dictatorship countries... so dumb is that how you feel good about yourself?",0,3
1003,2023-03-07T20:22:15Z,@ankitdubey459,"china have homogenous population, india doesnt.  China has communism , india has democracy. State and centre doesnt work cordially. India under congress didnt do shit progress because so called Manmohan Singh etc congress economist were brain dead and shitty as fk.  Like the guy said india needs to work on infra and education, ok I agree education budget needs to be improved. But can you really say bjp hasnt worked on infrastructure? Thirdly comparing the fdi to 2007 and 2022 is miles apart at that time we were not even around one trillion so 3.6 percent of that seems so big to you ..Wheres as we have grown four times to it thus 2 percent of it seems low. Its like this china is growing at 3-5 percent now after sustainable growth of 10 percent for a decade because growing the economy by 10 percent from 20 trillion is really really tough. Fourthly there is a particular threshold at around 4K $ gdp per capita, after which growth has been generally observed to be fast. This guy doesnt address that. He is basically a loony  talking about subjects which he doesnt know shit about.",2,0
1004,2023-03-07T20:12:00Z,@justarandomuser4395,Suddenly everybody is interested in India's economy and politics,0,0
1005,2023-03-07T20:04:14Z,@h.s3223,25 % of then still shit in the fields,1,1
1006,2023-03-07T18:27:34Z,@handcraftstreet3692,"very good analysis. Hope the politicians are watching. The young generation is growing, there's no time to lose.",0,0
1007,2023-03-07T18:18:59Z,@bhavesh4555,Jisko economy me problem lag rhi h toh thoda bangladesh pakistan aur srilanka ke bare me thoda padlo kitni achi zindagi chl rhi h hari,0,2
1008,2023-03-07T17:34:20Z,@ScrewyDriverTheMan,One word: CASTE.  Get rid of that SLAVERY system first ffs,2,0
1009,2023-03-07T17:16:28Z,@hamdimohammedtaha6415,"Actually Modi is useless, his supporters won't say this because they wanted him to assert majoritarianism upon Indian muslims. This is the plain truth.",0,1
1010,2023-03-07T17:14:55Z,@abhishekpawar5126,"Demonetisation in 2016 was the nail in the coffin for the Indian economy Forget catching up with China, even small countries like Vietnam and Bangladesh are about to race past India The IT industry pumps false hopes into the minds of Indian youth",0,2
1011,2023-03-07T16:40:41Z,@shrawins,"This seems more like a hit piece against India. India will and is growing at its pace. It's a democracy, everyone gets a say in what direction this country goes towards and I am happy with that.",0,0
1012,2023-03-07T16:28:37Z,@poonamkhatri3914,You will be called anti-national by bhakts ,4,1
1013,2023-03-07T15:52:22Z,@ashmoleproductions5407,4:50 I approached this with an open mind but the minute you started praising China I knew you were full of crap. For an actual look at the inner working of china Watch China insights China observer and ADV China they back up their observations and assertions with documentation and video evidence.,0,0
1014,2023-03-07T15:39:31Z,@drohi930,Data in a desi context has no meaning at all,0,0
1015,2023-03-07T14:30:26Z,@rahulkhatri137,One of key factor is education. People don't want to grow themselves by using new options & experiments. Even the degree holders don't have the knowledge but just that paper of certificate that creates real problem. Corruption & lack of job opportunities led India to lose it's bright minds to US & other countries.,378,6
1016,2023-03-07T13:27:44Z,@tigerathunt1,"Thats nice video .. most of the data are correct and it seems that economy is really screwed up after 2017 badly .. whether its debt, borrowing, fiscal deficit, growth rate, current account deficit, increase in poverty, increase in unemployment and trade deficit I think we have a government which is only doing PR and doing more on perception management than progress  We really lack educated leaders who can direct to better way",2,1
1017,2023-03-07T12:23:01Z,@justiceleague3517,"For India the benchmark of economic progress is comparison with Pakistan. Really I'm not even exaggerating. When things are not particularly well , they be like \""Well at least we're better than Pakistan\""",99,8
1018,2023-03-07T12:19:46Z,@kmmahir183,Hi dude Your videos are cool Want to work with you  Try to reach out if possible,0,0
1019,2023-03-07T11:05:04Z,@arpanjain1527,"yep, our govt spend very less on education and healthcare because we have to spend a lot on defence and border security as we have pakistan on one side and china on other. Our military have to be in constant combat ready mode in order to survive.",0,0
1020,2023-03-07T10:49:48Z,@nipunjha,"Thanks for such a biased video, you've compared two economics which are miles apart. One is a democracy other isn't. One had to deal with Britishers, partition other didn't. This kinds of videos are just shit. You're literally comparing apples to oranges. Just throwing numbers around won't help your channel grow dude.",2,11
1021,2023-03-07T10:26:27Z,@bigbrandtheory1220,"Indian economy moves like an elephant , it maybe slow but the growth is extremely reliable. Slow growth is the downside of democracy. But Indians are clear in their mind they have chosen a strong and goal driven leadership.",2,0
1022,2023-03-07T10:02:45Z,@Dr.Lakshit_ahari,"As an Indian, I can say our biggest problem is we have people with degrees who lack practical knowledge.  Ex. A BSC graduate has memorised the entitled curriculum but never done a single experiment.  *Basically people have a degree but lack Skills*.",13,1
1023,2023-03-07T08:55:01Z,@inspectionalquots,If  only I had just enough money to move out of India.,0,0
1024,2023-03-07T08:46:18Z,@prajjwaldwivedi5313,"Same bureaucracy(IAS, IPS, IT'S officers) that is glamorized and put at a very high pedestal is the biggest barrier in India's growth.",593,27
1025,2023-03-07T08:25:01Z,@javeedkhan3682,Instead govt believe spending in infrastructure than in human development,0,0
1026,2023-03-07T08:09:03Z,@puneetmishra4726,"One of the major drawbacks of Indian education system that this report does not cover is the irrational obsession Indians have over government university and jobs. The coaching industry for competitive exams is one of the biggest industries in the country and instead of adding any value to the skillset of the youth, they take away there most precious years by selling them a false promise of \""cracking the exam\"". Almost all of Indian youth waste at least 4-5 years of their life when they are below 25 in preparing those exams. If they put those years even in jobs that pay low wage but give them good experience and enhance there skillset, their condition would be far better. But sadly, Indian families would rather have their children beat there heads into books than letting them work in a job that might harm their social status",19,4
1027,2023-03-07T07:59:59Z,@manojkumar.n,"India should stop imports of what we manufacture in India like clothes,iron ,cements and chemicals etc",2,2
1028,2023-03-07T07:58:50Z,@hmsdefender408,"Pros and cons, China or other East Asian countries experienced vast and even violent social reforms as a fundamental for economic miracle, (communist revolution, U.S. occupation), because it released the mass labor available for manufacture industries. While India has always been in its organic and self developed social order but could not achieve economic miracle. However, because the Indian society preserves the relatively primitive social structure, India can remain populace while Chinese population ages too fast.",10,1
1029,2023-03-07T07:54:09Z,@AnimeSnips_,"Imagine if the government spent money on education and infrastructural development instead of army in the past and now we are living under the colonization of China. And you are watching this video with a title of \""What mistake India made which led the defeat against China\"" and people commenting \""Indian government should've focused on army when it was needed\"".",5,3
1030,2023-03-07T07:46:05Z,@santoshdesai7703,Astonished to see China being compared to India. China is a communist country the CCP is free to take any decisions without worrying about the consequences you cannot say the same about India. It takes time for the government to implement polices as we have two different governments taking care of state and nation. India will improve and become a super power of the world no doubt about that.As far as China is concerned we want it to balance the power in the region so there is no hegemony from West,1,0
1031,2023-03-07T07:31:37Z,@persiankingish,Here in India people vote on the basis of religion and caste and not on healthcare and education.,1321,47
1032,2023-03-07T07:08:21Z,@brexistentialism7628,"I believe the biggest problem for India is that everyone including themselves expect them to be the next China but the truth is they will have to do it in a different fashion as otherwise their economy and strategy will be totally predictable which makes smaller and more flexible economies able to strategically tackle Indias strategy. So, it's unlikely that India will win in the area of cheap labour like China did in the past. India will certainly grow its local market but it will be difficult to turn India into a global power player.",0,0
1033,2023-03-07T07:06:14Z,@bhanusawhney1956,western propaganda,3,4
1034,2023-03-07T06:20:52Z,@roseangel1553,"One thing that worries me is that, now india has largest young population. But one day will come(around 2070) when it will become world's largest old population. At that time india will have to spend a big amount of its budget on pensions and social services.",10,2
1035,2023-03-07T06:19:26Z,@manojkurmi2308,I am sure u will not get the same opportunity to say these things about India after 10 years..Then we shall make such videos about ur country...,0,1
1036,2023-03-07T05:50:11Z,@ranjith_argn7022,"The education & health sectors are privatised, so the government budget allocation is less compared.",0,1
1037,2023-03-07T05:40:04Z,@ayush_sri,"India's gdp growth stumped after 2015 ...  what happened, I guess somebody played with Indian economy even when they didn't know economics.",0,0
1038,2023-03-07T05:21:34Z,@huskysama9240,india's economy seems like its good only in paper...if you go out its dirt and poor everywhere. not saying im rich.,0,0
1039,2023-03-07T05:17:29Z,@chiluxr250,When we have a govt. who's bothered about power grabbing since its been to power what else we can expect. Modi govt. works for it self and its crony capitalists. They consider Human development and the Human rights laughable but are only bothered about the power grabbing and diving society using religion to achieve it.,0,0
1040,2023-03-07T05:15:16Z,@psarathy66,"https://en.wikipedia.org/wiki/List_of_countries_by_GDP_(PPP)   probably when india handle oil problem, it can automatically move down dollar price and the gdp  will go to 11.67tn$ and per capital income ot 15k usd",0,0
1041,2023-03-07T04:59:31Z,@shubhamtawsalkar2436,I think all is wrong in this video   Foreign power has started propoganda to topple our government,1,2
1042,2023-03-07T04:33:09Z,@hdhdhadn8356,So you're saying even if I graduated from a top-tier university in India I will still struggle to find unemployment since some employers don't recognize local degrees!,5,0
1043,2023-03-07T04:19:18Z,@mingoDmingo,"All thanks to modi, no one cares about these numbers specially if they are from  foreigners. Everyone is busy fighting for their relegion.",1,0
1044,2023-03-07T03:13:23Z,@kumarakshat1300,"I feel that India's biggest problem is democracy, since most of the population lives in rural areas and are not that literate, they usually cast their vote on the basis of relegion or caste which puts incompetent leaders in high position, leads to corruption which in turn leads to slow decision making process. But i also must say that other non democratic forms of government are a gamble, you will either get a good leader who takes efficient decisions for the good of the country eg: china. Or a bad leader who oppresses his people, for eg: north korea.",3,5
1045,2023-03-07T02:14:54Z,@eajinabi,A socialist/communist propaganda reel,1,1
1046,2023-03-07T02:14:33Z,@simple2224,Absolute truth when said indian education system is bad,2,0
1047,2023-03-07T02:07:50Z,@akshadbawa9778,"india and china are 2 very different countries, india has always placed social welfare over economic growth , even with so much economic growth china has failed its people by making them a meer puppet of the government  we should try to spend more on capital development and create long term assets  and strengthen our manufacturing sector just like our service sector , spend on education and technical skill development to fully realise demographic dividend, spend on healthcare etc",5,3
1048,2023-03-07T01:06:54Z,@mogleesh22,One reason: Overpopulation Solution: Two child policy in India.,2,1
1049,2023-03-07T00:42:53Z,@Sinhei,Corruption by the politicians,3,0
1050,2023-03-07T00:07:48Z,@pushparaj1378,Thank god someone has brains,0,0
1051,2023-03-06T23:30:56Z,@gametabulas,*THE GRASS ALWAYS IS GREENER ON THE OTHER SIDE*,0,0
1052,2023-03-06T22:57:38Z,@PK-se2jh,Hope our India dont fall into some decline. Hope government does something about these issues.,1,0
1053,2023-03-06T22:15:49Z,@junmoon7230,Typical sensitive indians in the comments,1,0
1054,2023-03-06T19:41:24Z,@whocare336,A huge amount of Taxpayers money goes as salary of government employees where productivity is very less sometime even negative.,1309,83
1055,2023-03-06T19:38:29Z,@whocare336,A huge amount of Taxpayers money goes as salary of government employees where productivity is very less sometime even negative.,4,0
1056,2023-03-06T19:37:29Z,@whocare336,A huge amount of Taxpayers money goes as salary of government employees where productivity is very less sometime even negative.,2,0
1057,2023-03-06T19:24:09Z,@riddhirahman,Also India suffers from brain drain the educated ones don't stay/try to stay in their homeland,2,2
1058,2023-03-06T19:19:23Z,@riddhirahman,China's growth is unreal man,3,5
1059,2023-03-06T18:58:23Z,@muneebahmad7887,you're going to trigger a lot of indian nationalists and delusionists with this one...,0,0
1060,2023-03-06T17:29:43Z,@user-bd9ep9sj5h,India will be a 5T $ economy.. that's not a big deal... But we have to compete with China which is far far away.,1,0
1061,2023-03-06T17:24:48Z,@augu345,"India is basically China  yeah  Censored Media  Authoritarian government  Corruption  Dirty Politics only thing that makes us diffrent from China is, our sh*t *looks* democratic with a spice of Religion",2,1
1062,2023-03-06T17:20:03Z,@shyamcharan2891,"The best video I've ever seen on the Indian economy,not only the video had perfect details and analysis but also great animations , videography and editing",7,0
1063,2023-03-06T14:52:55Z,@abhinavayush967,All thanks to kongress for 1 percent growth.,3,0
1064,2023-03-06T13:56:50Z,@raviv3398,"India is in situation right now that they can spend only in few areas. Since independence, there was no vision for a country except to be socialist country. Draw back of socialism is no one wants to work on productive side. No infrastructure gets build. Even after 75 years, Mumbai and Delhi, two major city of India, there is no proper road connectivity. Last few years, India is creating so many elevated express highway like Western standards, renovating airports and railway stations. Huge infrastructure push is going on currently. Now, only after infrastructure is built properly, more opportunity would come which in terms give gov more time to invest in social cause of education and health.",1,0
1065,2023-03-06T13:17:42Z,@KhalidHussain-lb9nc,"the biggest problem of india is religious politics. indians are soo busy fighting each other, that the leaders take advantage of it and keep them busy in religious politics and distracting them from main issues like health education. for as long as indians keep fighting over these issue indias economy will grow but at a 10x slower pace.",6,0
1066,2023-03-06T12:45:35Z,@saikrishna-fz1xf,Still Modi bhakts feel India is doing better. Hopeless.,2,0
1067,2023-03-06T12:42:33Z,@arvindh4327,Will India ban this content too ?,1,0
1068,2023-03-06T12:32:07Z,@pranavvenugopal2609,Couple of low esteem unnecessary self critic indians down in the comment section ......we are 3rd largest by ppp terms...and it has grown...,1,0
1069,2023-03-06T12:10:40Z,@WaiKoH,"Personally India will never out perform China in the long run, if they continue to engage with and hope to replace China as trade center. China has proven that US will do everything to limit you once they feel threatened.",2,0
1070,2023-03-06T12:04:34Z,@killxAyush,"India should remove bureaucracy,  people hate to do business here because of very complicated structure,  govt interference,  corruption by govt employees,  politics.",0,0
1071,2023-03-06T11:43:16Z,@gr5217,INDIA STARTED ON WRONG FOOT IN 1947 WITH SOCIALISM & SECULARISM. SOCIALISM IN PREINDUSTRIAL COUNTRY IS RECIPE FOR DISASTER,3,5
1072,2023-03-06T11:19:19Z,@KellenBricks,"the numbers for gdp per capita is inaccurate, russia's gdp per capita is not that high.",1,0
1073,2023-03-06T11:08:20Z,@VinodMenon1978,India is doing good now. Please dont write and kill her in your YouTube channel.,0,0
1074,2023-03-06T11:01:30Z,@mithildixit4416,"Thankyou for speaking the truth about my country, many times people get caught up in the surface level data and don't bother understanding the very deep rooted issues facing India. This limits the country from progressing, I think for change India needs to be sure of what it is doing wrong.",186,9
1075,2023-03-06T10:52:53Z,@jamesbluntjamesblun1,Indias government has only one thing for the youth of the country it's called azadi ka amruth Mohostav which is now floating on the holiest rivers of Hinduism ,1,1
1076,2023-03-06T10:23:42Z,@DV2088,U have to be stupid to analyse India with other countries.   Bcz most of India's economy is unaccounted  Only 5-10% people pay income tax. There is a huge gap of unorganised sector. And no youth is not unemployed. It's just that people who are in unorganised sector don't report their earnings.   Man it will take hell lot of thinking before calculating the GDP of this nation,0,0
1077,2023-03-06T10:03:04Z,@GaurangAsthana,"All things considered, you need to understand that you are trying to find parallels with your own country's economic development. This has always resulted in wrong predictions. There are several local factors that change how things work out for every country. If you turn out to be right, well congratulations. But I found a lot of your points didn't consider some local factors.",1,0
1078,2023-03-06T09:54:05Z,@shubhampawaskar6694,Yup definitely. You wanna cut taxes to attract businesses but increase spending on education all while the deficit is high ,1,0
1079,2023-03-06T09:48:27Z,@hamdimohammedtaha6415,Modi can't cure the diseases India is suffering from. It is utopian dream of Modi's chamchas that is far removed from the reality that exists.,1,0
1080,2023-03-06T09:18:27Z,@rishavlala709,"In a democracy as big as India, often it hinders the pace at which countries like China move ahead with policies. In India populist schemes are burning through the budget and it's hard to revert from such an approach due to public outcry over them . Farm laws are an example of how India wanted to bring reforms into the agriculture sector but couldn't break through the populist schemes.",200,55
1081,2023-03-06T09:06:53Z,@rajibchakroborthy4181,Hey expert India's foreign investment higher its 83billion what u talking abt indian tax and land law simplified have knowledge before post,1,3
1082,2023-03-06T08:58:44Z,@alanliang9538,any educated indian will brain drain away.,1,0
1083,2023-03-06T08:56:06Z,@darshanpatel9006,"I am an INDIAN & i would like to tell you is this propaganda will not work,dear! India will rise like no economy will ever risen in history. - Indian government is given free health insurance to low income people. - India have very skilled labour which produced by institutes like IITs & IIMs (with low budget, 2-5% budget of MIT & Cambridge!!).  - India is invested 70 trillion indian rupee in infrastructure & Rail-Road-Port & Air! - India have MSME which support big manufacturing industry, very unique manufacturing clusters & eco system. - Biggest Tech start-up ecosystem (5 Cities known as silicon velly of the world - Bangalore, Delhi, Pune, Mumbai & Hyderabad) - India Produced commodities like no country can produce in that scale - Food & Natural minarals. - Biggest Pharma Manufacturer & Exporter (Given covid vaccine to 50 country & 300 million dose to indian population for free!!!!!)  There are many many points i would like to inform you but in your next Video about India.",0,0
1084,2023-03-06T08:50:13Z,@jayantchandrakar9952,"India is a chaotic country, everything is in chaos but still in order , one thing here is competition.. whatever world tell we will grow .. it is a turtle race ...",0,0
1085,2023-03-06T08:42:12Z,@magma9000,WORLD SHOULD OFFICIALLY RECOGNISED KASHMIR AS PART OF PAKISTAN ,0,7
1086,2023-03-06T08:35:27Z,@Carrera1990,India failed state,0,0
1087,2023-03-06T08:28:15Z,@greenearth9945,China =  India = ,1,2
1088,2023-03-06T08:13:55Z,@SS-yv9cq,Eating curry should help them become a supa-power!,1,0
1089,2023-03-06T07:54:18Z,@krishnasingh-hb9hv,for me the reason for long term jobless growth is because of shifting directly to service sector growth (which do not create much job) rather than industrial growth(which is a job creating sector),17,0
1090,2023-03-06T07:40:02Z,@muhammadmohsinkaamils4940,Indian Economy going on back side.,0,0
1091,2023-03-06T06:48:18Z,@deepeshbajpai8543,A stupid western tell about India Education ,1,2
1092,2023-03-06T06:31:01Z,@kkk66969,Government rather than planning long term policies are more indulged in short term votebank politics,2,0
1093,2023-03-06T06:23:18Z,@TonyStark-vx9qz,India under this government has done a better job than previous governments,1,0
1094,2023-03-06T05:45:16Z,@gaminggun1000,"Its difficult to find employees nowadays as everyones doing their own business,this is not true..(taxis,auto rickshaw,painting,electricians,Swiggy,Rapido,Ac mechanics,bike mechanics) they earn more than someone on a desk job and have freedom to take leave or not work for a few days,also we are a agriculture economy,farmers sow crops,come to cities do part time work and then go back for harvest",1,0
1095,2023-03-06T05:28:34Z,@rishabhverma8159,"Very cleverly the data points taken into consideration are the highest percentages in last 10 years compared with 2020 numbers, which would obviously be drastically low due to COVID. That's not smart. Dataset for 2021 and some numbers for 2022 are present on the govt website.",3,0
1096,2023-03-06T05:17:01Z,@harshitsingh7042,India must focus on service sector,0,0
1097,2023-03-06T05:03:44Z,@yashasvichauhan4417,Thankyou very much for bringing up the issue of India's failed education system,4,0
1098,2023-03-06T03:48:51Z,@rickyho4305,"India's growth problem is also deeply rooted in its thousand year culture and religion. Most east asian cultures are more grounded in the current life and focus on improving their standard of living in this life. India has a much broader and deeper spiritual component that often gets in the way of progress. Not to say it's wrong, but it certainly affects the productivity of everyday workers and their mentality.",6,2
1099,2023-03-06T03:18:08Z,@yugsavla3872,Most constructive criticism of my country and I hope we improve on it.,14,1
1100,2023-03-06T03:13:29Z,@crypticTV,2:48 women working,0,0
1101,2023-03-06T02:08:31Z,@poparrow9416,But I wish u realize that India also facing socialism and also...well colonization. Japan and China had decent industrilization before WW btw,0,0
1102,2023-03-06T01:52:36Z,@akhilkn225,"Pakistan is on ventilator, USA has hit debt ceiling ( 129% of gdp ) , china's debt to gdp is 70%.(more than $5 trillion ) China's gdp figures are fudged more than double this means that their actual debt  is more than 100%. Wherever indias debt is almost equal to it's forex reserves (around $600 billion ).",1,0
1103,2023-03-06T01:52:22Z,@akhilkn225,US is sucking in all resources around the world by printing paper. US is responsible for price rise of commodities around the world as it can print unlimited dollars without any check and distribute among its citizens. When US is ready to buy things at high price why would someone sell their commodity at lower price to a middle income country. Since the last trade price becomes the current market price everyone else end up paying higher .,1,0
1104,2023-03-05T22:50:45Z,@MiSt3300,"4:00 Russia's flag is incorrect, this is the flag of Slovakia",0,0
